{
  "$schema": "https://json-schema.org/draft/2020-12/schema",
  "$id": "specialist_fragment.v1",
  "title": "Fragmento de especialista de comodo",
  "description": "Sub-especialista de um comodo: um topico tratado mais a fundo (marcenaria, posicionamento, fonte da verdade, demos...). So APONTA para o que ja existe (capacidades, bindings, recipes, specs, codigo, testes, alvos, golden, demos); nao concede execucao nem cria regra. Validado por tools.rooms.specialist_fragments.",
  "type": "object",
  "additionalProperties": false,
  "required": ["schema_version", "room", "id", "title", "focus", "capability_ids", "binding_ids", "recipe_ids", "specs", "code",
               "tests", "skills", "reference_targets", "golden_sources", "demos", "open_decisions", "stop_conditions"],
  "properties": {
    "schema_version": {"const": "specialist_fragment.v1"},
    "room": {"enum": ["living", "bedroom", "kitchen", "bathroom", "service", "balcony", "closet", "home_office", "circulation"]},
    "id": {"type": "string", "pattern": "^[a-z][a-z0-9_]{2,40}$"},
    "title": {"type": "string", "minLength": 3},
    "focus": {"type": "string", "minLength": 20, "description": "o que este fragmento trata mais a fundo do que o perfil do comodo"},
    "capability_ids": {"type": "array", "items": {"type": "string"}, "uniqueItems": true,
                       "description": "capacidades do perfil que este fragmento DONO responde (cada uma em exatamente um fragmento do comodo)"},
    "binding_ids": {"type": "array", "items": {"type": "string"}, "uniqueItems": true,
                    "description": "bindings do comodo (inclusive lacunas sem capacidade) que este fragmento responde"},
    "recipe_ids": {"type": "array", "items": {"type": "string"}, "uniqueItems": true},
    "specs": {"type": "array", "items": {"type": "string"}, "uniqueItems": true},
    "code": {"type": "array", "items": {"type": "string"}, "uniqueItems": true},
    "tests": {"type": "array", "items": {"type": "string"}, "uniqueItems": true},
    "skills": {"type": "array", "items": {"type": "string"}, "uniqueItems": true},
    "reference_targets": {"type": "array", "items": {"type": "string"}, "uniqueItems": true,
                          "description": "FP-052: manifestos reference_target.v1 da instancia (fonte da verdade do alvo)"},
    "golden_sources": {"type": "array", "items": {"type": "string"}, "uniqueItems": true,
                       "description": "golden/decisoes aprovadas que ancoram este topico (aprovacao do AMBIENTE nao aprova peca)"},
    "demos": {"type": "array", "items": {"type": "string"}, "uniqueItems": true,
              "description": "FP-053 (demo-first): micro-demos/golden de comportamento quando existirem"},
    "open_decisions": {"type": "array", "items": {"type": "string"}},
    "stop_conditions": {"type": "array", "items": {"type": "string"}, "minItems": 1},
    "notes": {"type": "string"}
  }
}
